{
  "format": "delta-reviewed-score/v1",
  "title": "欧布奥特曼红凯之歌 / Ultraman Orb Gais Orbnica",
  "composer": "小西貴雄（用户谱面写作“西木贵雄”）",
  "source": {
    "path": "../input/red-kai-song-score.png",
    "sha256": "BF684DBB7093FC8EA0DEA77B7700BDA2945552A58028C5A57104E852740F73E5",
    "document_type": "image"
  },
  "bpm": 88,
  "bpm_origin": "printed_score",
  "printed_tempo_text": "♩=88",
  "printed_numeric_bpm": 88,
  "time_signature": {"numerator": 4, "denominator": 4},
  "ticks_per_beat": 480,
  "parts": [
    {
      "id": "melody",
      "label": "单旋律（按谱面章节）",
      "measures": [
        {"id":"a1","label":"A1","source_ref":"page 1 / section A / measure 1","events":[
          {"type":"rest","offset_beats":"0","duration_beats":"1","review_state":"visually_checked"},{"type":"rest","offset_beats":"1","duration_beats":"1","review_state":"visually_checked"},{"type":"note","offset_beats":"2","duration_beats":"1/2","pitch":52,"review_state":"visually_checked"},{"type":"note","offset_beats":"5/2","duration_beats":"1/2","pitch":60,"review_state":"visually_checked"},{"type":"note","offset_beats":"3","duration_beats":"1/4","pitch":59,"review_state":"visually_checked"},{"type":"note","offset_beats":"13/4","duration_beats":"1/4","pitch":48,"review_state":"visually_checked"},{"type":"rest","offset_beats":"7/2","duration_beats":"1/2","review_state":"visually_checked","review_note":"Implied by the printed 4/4 bar after the visible sixteenth-note pair."}]},
        {"id":"a2","label":"A2","source_ref":"page 1 / section A / measure 2","events":[
          {"type":"note","offset_beats":"0","duration_beats":"2","pitch":52,"review_state":"visually_checked"},{"type":"note","offset_beats":"2","duration_beats":"1/2","pitch":52,"review_state":"visually_checked"},{"type":"note","offset_beats":"5/2","duration_beats":"1/2","pitch":60,"review_state":"visually_checked"},{"type":"note","offset_beats":"3","duration_beats":"1/4","pitch":59,"review_state":"visually_checked"},{"type":"note","offset_beats":"13/4","duration_beats":"1/4","pitch":48,"review_state":"visually_checked"},{"type":"rest","offset_beats":"7/2","duration_beats":"1/2","review_state":"visually_checked","review_note":"Implied by the printed 4/4 bar after the visible sixteenth-note pair."}]},
        {"id":"a3","label":"A3","source_ref":"page 1 / section A / measure 3","events":[
          {"type":"note","offset_beats":"0","duration_beats":"2","pitch":50,"review_state":"visually_checked"},{"type":"note","offset_beats":"2","duration_beats":"1/2","pitch":52,"review_state":"visually_checked"},{"type":"note","offset_beats":"5/2","duration_beats":"1/2","pitch":60,"review_state":"visually_checked"},{"type":"note","offset_beats":"3","duration_beats":"1/4","pitch":59,"review_state":"visually_checked"},{"type":"note","offset_beats":"13/4","duration_beats":"1/4","pitch":48,"review_state":"visually_checked"},{"type":"rest","offset_beats":"7/2","duration_beats":"1/2","review_state":"visually_checked","review_note":"Implied by the printed 4/4 bar after the visible sixteenth-note pair."}]},
        {"id":"a4","label":"A4","source_ref":"page 1 / section A / measure 4","events":[
          {"type":"note","offset_beats":"0","duration_beats":"3/2","pitch":62,"review_state":"visually_checked"},{"type":"note","offset_beats":"3/2","duration_beats":"1/2","pitch":60,"review_state":"visually_checked"},{"type":"note","offset_beats":"2","duration_beats":"1/2","pitch":59,"review_state":"visually_checked"},{"type":"note","offset_beats":"5/2","duration_beats":"1/2","pitch":67,"review_state":"visually_checked"},{"type":"note","offset_beats":"3","duration_beats":"1","pitch":54,"tie_out":true,"review_state":"visually_checked"}]},
        {"id":"a5","label":"A5","source_ref":"page 1 / section A / measure 5","events":[
          {"type":"note","offset_beats":"0","duration_beats":"1/2","pitch":54,"tie_in":true,"review_state":"visually_checked"},{"type":"note","offset_beats":"1/2","duration_beats":"1/2","pitch":69,"review_state":"visually_checked"},{"type":"note","offset_beats":"1","duration_beats":"3/2","pitch":62,"review_state":"visually_checked"},{"type":"rest","offset_beats":"5/2","duration_beats":"1","review_state":"visually_checked"},{"type":"note","offset_beats":"7/2","duration_beats":"1/4","pitch":50,"review_state":"visually_checked"},{"type":"note","offset_beats":"15/4","duration_beats":"1/4","pitch":52,"review_state":"visually_checked"}]},
        {"id":"a6","label":"A6","source_ref":"page 1 / section A / measure 6","events":[
          {"type":"note","offset_beats":"0","duration_beats":"3/2","pitch":65,"review_state":"visually_checked"},{"type":"note","offset_beats":"3/2","duration_beats":"1/4","pitch":64,"review_state":"visually_checked"},{"type":"note","offset_beats":"7/4","duration_beats":"1/4","pitch":65,"review_state":"visually_checked"},{"type":"note","offset_beats":"2","duration_beats":"3/2","pitch":67,"review_state":"visually_checked"},{"type":"note","offset_beats":"7/2","duration_beats":"1/4","pitch":65,"review_state":"visually_checked"},{"type":"note","offset_beats":"15/4","duration_beats":"1/4","pitch":67,"review_state":"visually_checked"}]},
        {"id":"a7","label":"A7","source_ref":"page 1 / section A / measure 7","events":[
          {"type":"note","offset_beats":"0","duration_beats":"2","pitch":57,"review_state":"visually_checked"},{"type":"note","offset_beats":"2","duration_beats":"1/4","pitch":56,"review_state":"visually_checked"},{"type":"note","offset_beats":"9/4","duration_beats":"1/4","pitch":69,"review_state":"visually_checked"},{"type":"note","offset_beats":"5/2","duration_beats":"1","pitch":59,"review_state":"visually_checked"},{"type":"note","offset_beats":"7/2","duration_beats":"1/2","pitch":64,"review_state":"visually_checked"}]},
        {"id":"a8","label":"A8","source_ref":"page 1 / section A / measure 8","events":[
          {"type":"note","offset_beats":"0","duration_beats":"1/2","pitch":62,"review_state":"visually_checked"},{"type":"note","offset_beats":"1/2","duration_beats":"1/2","pitch":60,"review_state":"visually_checked"},{"type":"note","offset_beats":"1","duration_beats":"1/2","pitch":59,"review_state":"visually_checked"},{"type":"note","offset_beats":"3/2","duration_beats":"1/2","pitch":48,"slur_start":true,"review_state":"visually_checked"},{"type":"note","offset_beats":"2","duration_beats":"2","pitch":60,"slur_end":true,"review_state":"visually_checked"}]},
        {"id":"b1","label":"B1","source_ref":"page 1 / section B / measure 1","events":[
          {"type":"rest","offset_beats":"0","duration_beats":"1","review_state":"visually_checked"},{"type":"rest","offset_beats":"1","duration_beats":"1","review_state":"visually_checked"},{"type":"note","offset_beats":"2","duration_beats":"1/2","pitch":64,"review_state":"visually_checked"},{"type":"note","offset_beats":"5/2","duration_beats":"1/2","pitch":72,"review_state":"visually_checked"},{"type":"note","offset_beats":"3","duration_beats":"1/4","pitch":71,"review_state":"visually_checked"},{"type":"note","offset_beats":"13/4","duration_beats":"1/4","pitch":72,"review_state":"visually_checked"},{"type":"rest","offset_beats":"7/2","duration_beats":"1/2","review_state":"visually_checked","review_note":"Implied by the printed 4/4 bar after the visible sixteenth-note pair."}]},
        {"id":"b2","label":"B2","source_ref":"page 1 / section B / measure 2","events":[
          {"type":"note","offset_beats":"0","duration_beats":"2","pitch":64,"review_state":"visually_checked"},{"type":"note","offset_beats":"2","duration_beats":"1/2","pitch":64,"review_state":"visually_checked"},{"type":"note","offset_beats":"5/2","duration_beats":"1/2","pitch":72,"review_state":"visually_checked"},{"type":"note","offset_beats":"3","duration_beats":"1/4","pitch":71,"review_state":"visually_checked"},{"type":"note","offset_beats":"13/4","duration_beats":"1/4","pitch":72,"review_state":"visually_checked"},{"type":"rest","offset_beats":"7/2","duration_beats":"1/2","review_state":"visually_checked","review_note":"Implied by the printed 4/4 bar after the visible sixteenth-note pair."}]},
        {"id":"b3","label":"B3","source_ref":"page 1 / section B / measure 3","events":[
          {"type":"note","offset_beats":"0","duration_beats":"2","pitch":62,"review_state":"visually_checked"},{"type":"note","offset_beats":"2","duration_beats":"1/2","pitch":64,"review_state":"visually_checked"},{"type":"note","offset_beats":"5/2","duration_beats":"1/2","pitch":72,"review_state":"visually_checked"},{"type":"note","offset_beats":"3","duration_beats":"1/4","pitch":71,"review_state":"visually_checked"},{"type":"note","offset_beats":"13/4","duration_beats":"1/4","pitch":72,"review_state":"visually_checked"},{"type":"rest","offset_beats":"7/2","duration_beats":"1/2","review_state":"visually_checked","review_note":"Implied by the printed 4/4 bar after the visible sixteenth-note pair."}]},
        {"id":"b4","label":"B4","source_ref":"page 1 / section B / measure 4","events":[
          {"type":"note","offset_beats":"0","duration_beats":"3/2","pitch":62,"review_state":"visually_checked"},{"type":"note","offset_beats":"3/2","duration_beats":"1/2","pitch":72,"review_state":"visually_checked"},{"type":"note","offset_beats":"2","duration_beats":"1/2","pitch":71,"review_state":"visually_checked"},{"type":"note","offset_beats":"5/2","duration_beats":"1/2","pitch":67,"review_state":"visually_checked"},{"type":"note","offset_beats":"3","duration_beats":"1","pitch":66,"tie_out":true,"review_state":"visually_checked"}]},
        {"id":"b5","label":"B5","source_ref":"page 1 / section B / measure 5","events":[